Record,Description,Connection strength,Preferred Stage,Preferred Sector
Town Hall Ventures,"Town Hall Ventures is a venture capital and private equity firm that focuses on investing in health care solutions for underserved communities. They partner with passionate entrepreneurs to support the growth of impactful companies like Cityblock, Brig...",Very weak,,Healthcare
The Spartan Group,"Spartan Group is a leading blockchain investment and advisory firm based in Singapore and Hong Kong. Our partners are former veterans from the banking, hedge fund and venture capital worlds. We offer bespoke advisory services for leading blockchain projects and companies seeking to implement their Asia expansion, fundraising and ecosystem strategies. In addition, we also invest in blockchain projects via our investment arm.",Weak,"Seed,Early Stage,Growth Stage",Blockchain
protalabs.com,"Prota Ventures is a venture building and early stage investment firm with a mission to launch inspiring new ventures and invest in early stage founders. They promote human flourishing by investing holistically in entrepreneurs, believing in generosity,...",Good,"Angel,Seed,Early Stage",
Wheelhouse.io,"Wheelhouse is a company that serves as growth partners, specializing in design, operations, and investments. They provide services in venture capital and private equity, offering expertise in design, operations, and investment strategies to support bus...",Very weak,,
Calm Ventures,Calm Ventures is a Los Angeles-based venture capital firm investing in breakout technology companies to drive growth and innovation.,,,
U First Capital,"U First Capital is a Silicon Valley-based firm that offers Venture Capital as a Service for Corporations. With a strong technology background and deep connections in the industry, they drive investments as a Corporate Venture Capital Innovation Hub, co...",Good,"Seed,Series A,Early Stage",
Share Ventures,"Share Ventures is a venture studio that invents and invests in companies unlocking human potential. They create new business concepts, provide seed funding, and drive acceleration through strategic partnerships with influencers, corporations, and inves...",Weak,"Angel,Seed,Early Stage","AI,FinTech,Healthcare,Consumer,Climate Tech"
BTG Network,"Beyond The Game Network is a community of professional athletes and business executives that partners with startups in the sports, media, and consumer sectors. They bring together athletes, startups, and business executives to create a powerful ecosyst...",Weak,"Pre-Seed,Seed,Series A,Early Stage,Growth Stage",Consumer
Keter Point,"Keter Point is an active investor in hospitality real estate, public markets, and early-stage private companies, with a focus on socially responsible investments and industry diversification.",Weak,"Angel,Seed,Early Stage",
Bloccelerate VC,"Bloccelerate is a venture fund and accelerator based in Seattle, WA, supporting entrepreneurs in building category-defining companies using blockchain technology. They provide mentoring, go-to-market solutions, access to peers and developers, academic ...",Strong,,Blockchain
Fika Ventures,Fika Ventures: Boutique seed fund investing in innovative solutions for meaningful problems through data and AI technologies.,Weak,"Angel,Seed,Early Stage","AI,Consumer,Big Data,Climate Tech"
Dorm Room Fund,"Dorm Room Fund is the original student preseed venture capital fund, backing student founders with investors, mentors, and their first check to propel their companies forward and kickstart careers in entrepreneurship and investing.",Very weak,"Angel,Pre-Seed,Seed",
Outlier Ventures,"Outlier Ventures is the world's leading Open Metaverse accelerator program, investing in and partnering with the best Web3 founders. They support over 100 startups annually, focusing on DeFi, NFTs, and blockchain infrastructure, with a strong emphasis ...",Very strong,"Angel,Seed,Series A,Early Stage","DeFi,Blockchain,NFTs"
denargo,Denargo Capital LLC: Colorado-based private equity firm enhancing business value and potential since the late 19th Century.,Very weak,,
G20 Ventures,"G20 Ventures is a capital partner that supports the growth of new businesses by providing early traction capital for East Coast enterprise technology startups. Backed by the expertise of 20 accomplished entrepreneurs, G20 Ventures offers smart money, g...",Very weak,"Pre-Seed,Seed,Early Stage","FinTech,Enterprise"
Bayes Ventures,,Very weak,,"FinTech,E-Commerce / Marketplaces,Insurtech"
KAYA VENTURES,"Kaya Ventures is an early stage venture capital firm led by Madeline Darcy, focused on expanding access to wellness. With a unique ability to identify emerging trends, support founders, and capitalize on market opportunities, Kaya Ventures aims to impr...",Weak,"Angel,Seed,Early Stage","Healthcare,Consumer,Climate Tech"
MyAsiaVc,"MyAsiaVC invests in businesses that leverage the secondary and tertiary effects of macrotrends, such as the disruptions caused by Covid-19 and advancements in networked societies, machine learning, and energy storage, to create innovative solutions in ...",Very strong,"Series A,Series B,Early Stage,Growth Stage","AI,Machine Learning,Climate Tech"
Alchemist Accelerator,"Alchemist Accelerator is a top-ranked venture-backed accelerator specializing in early-stage ventures monetizing from enterprises. It offers a 6-month program, seed investment, and corporate services through AlchemistX, including the AXII podcast.",Very weak,"Angel,Seed,Early Stage","Enterprise,E-Commerce / Marketplaces"
Reciprocal Ventures,Reciprocal Ventures: A NY-based VC firm shaping the future of Web3 by empowering developers with smart contract platforms like Solana.,Good,,"Web3,Blockchain"
Primer Sazze Partners,"At Sazze Partners, we invest in ideas with global ambition across East Asia and North America. With your ambition and our experience, we mentor your first steps into entrepreneurship and help you expand your vision into a global business.",Very weak,"Angel,Seed,Early Stage",
Lemniscap,Lemniscap is an early-stage investment firm that focuses on investing in emerging cryptoassets and blockchain startups.,Very weak,"Angel,Seed,Early Stage","Crypto,Blockchain"
The National Venture Capital Association - NVCA,"The National Venture Capital Association (NVCA) is the premier trade association representing the U.S. venture capital industry. With over 400 member firms, NVCA advocates for the importance of venture capital in the U.S. economy, supports entrepreneur...",Very strong,,
Crew Capital,Crew Capital is a venture capital firm investing in category-defining technology companies with a unique strategy driven by active operator GP's and institutional-grade resources.,Very weak,,
ECHELON,"ECHELON: A VC Fund of Funds in the TFS Ecosystem, uniting emerging managers with diverse industry backgrounds for a unique investment approach.",Very weak,,
HashKey Capital,"HashKey Capital is a global leader in digital assets and blockchain technology, empowering pioneers to build the open economy and driving industry adoption through investments and support.",Very weak,,"Crypto,Blockchain"
Carta,"Carta provides a comprehensive platform that assists innovators throughout their journey from initial concept to initial public offering, focusing on enhancing equity ownership accessibility for a broader audience.",Very strong,"Growth Stage,Late Stage","FinTech,Enterprise,Cloud Computing"
Sapir Venture Partners,"Sapir Venture Partners is a pre-seed deep tech VC firm specializing in foodtech, agtech, biotechnology, and other cutting-edge sectors. With a focus on empowering entrepreneurs, they invest in seed-stage companies at the forefront of innovation in vari...",Very weak,"Pre-Seed,Seed","Biotech / Life Sciences,Climate Tech"
StartFast,"StartFast Ventures focuses on investing in B2B SaaS companies located outside of major venture capital hubs, aiming to support and back innovative businesses that have the potential to create significant global impact.",Weak,"Seed,Series A,Series B,Early Stage","FinTech,E-Commerce / Marketplaces"
draper dragon,"Draper Dragon, founded in 2006, is a cross-border venture fund connecting Silicon Valley and Asia. Specializing in early-stage disruptive companies, it has a strong track record in technology and healthcare investments.",Very weak,"Angel,Seed,Early Stage",Healthcare
Avalanche VC,"Avalanche VC invests early in transformative trends in learning, earning, and ownership, seeking founders with a forward-moving vision.",Very weak,"Pre-Seed,Seed,Series A,Early Stage",
Asymmetry Ventures,"Venture capital firm investing in early stage companies with exceptional defensibility, backing those that push humanity forward.",Very strong,"Angel,Seed,Early Stage",
Alpha Venture Partners,"Alpha Partners accelerates private technology companies by investing in top tier growth equity rounds with early stage VCs, providing rational and agile capital to fill financing gaps and support rapid growth.",Very weak,"Series A,Series B,Series C+,Early Stage,Growth Stage",
Meridian Street Capital,"Meridian Street focuses on early-stage healthcare investments, strategically supporting founders at the convergence of healthcare and technology from the outset.",Very weak,"Pre-Seed,Seed,Early Stage",Healthcare
Blockchain Builders Fund,"Stanford Blockchain Community Leaders and Lecturers inspiring, building, and investing in blockchain technology for widespread adoption.",Weak,"Angel,Pre-Seed,Seed,Series A,Early Stage",Blockchain
ennea capital partners,"ennea capital partners serves as a strategic partner for European founders in the travel industry, offering expert guidance and resources to help them build, scale, and successfully exit market-leading travel companies.",Very weak,,
Compa Capital,Compa Capital focuses on investing in teams that enable individuals to have ownership and stake in various aspects of the internet.,Weak,,"Web3,Blockchain,Creator Economy"
Foresight Ventures,"Foresight Ventures is a crypto investment firm dedicated to backing disruptive innovation in blockchain. They manage multiple funds with over $400 million in assets under management, including a VC fund, an actively managed secondary fund, and a privat...",Very weak,,"Crypto,Blockchain"
Elixir Capital,Elixir Capital is a digital asset fund that supports founders in the Web3 space by backing those pushing the boundaries of open-source software and decentralized technology. They partner with select protocols to facilitate the development of essential ...,Weak,"Seed,Series A,Early Stage","Web3,Blockchain"
LongHash Ventures,"LongHash Ventures is a Web3 venture fund and accelerator that collaborates with founders to develop tokenomics, governance, and communities, investing in DeFi projects and partnering with Polkadot and Filecoin.",Weak,"Seed,Early Stage,Growth Stage","Web3,Crypto,DeFi"
Multicoin Capital,"Tushar Jain is a thesis-driven investment firm that focuses on making long-term, high-conviction investments in cryptocurrencies, tokens, and blockchain companies that are transforming significant markets.",Good,,"Crypto,Blockchain,FinTech"
Form Capital,"Form Capital is an early stage fund and design partnership founded by Bobby Goodlatte and Josh Williams. They invest real design expertise alongside seed capital, offering design sprints covering branding, pitch decks, packaging, and product UX flows a...",Very weak,"Angel,Seed,Early Stage","AI,FinTech,Consumer,Big Data,Collaboration / Productivity Tools,E-Commerce / Marketplaces"
Struck Capital,"Struck Capital specializes in investing in and developing transformative technology at the seed stage, utilizing proprietary AI and machine learning tools to enhance recruitment processes and connect portfolio companies with top-tier talent.",Good,"Seed,Early Stage","AI,Machine Learning"
BAD BITCH EMPIRE,BAD BITCH EMPIRE is a global community venture collective that elevates visionary female leaders to build empires and invest in high-impact female-led businesses. They provide unapologetic worth and wealth for women through investing in Bad Bitch Busin...,Good,"Seed,Early Stage,Growth Stage",Consumer
sage investment group,"Sage Investment Group is a small but impactful firm specializing in investment and capital referrals. They have strong relationships with key investors across various sectors and offer cost-effective services, charging only a third of typical brokerage...",,,
Shima Capital,Shima Capital is an early-stage global venture firm dedicated to supporting innovative blockchain startups.,Very weak,"Angel,Seed,Early Stage",Blockchain
VedasLabs,"VedasLabs.io operates a technology-driven social venture platform that facilitates direct connections between founders, investors, and mentors, enabling individuals to learn about and invest in high-impact early-stage startups.",Weak,"Angel,Seed,Early Stage","Consumer,Social Media"
Sapphire Ventures,"Sapphire Ventures is a leading global technology-focused venture capital firm with over $10.2 billion in assets under management. They partner with visionary teams and venture funds to scale companies of consequence, offering a strategic blend of value...",Weak,"Series C+,Growth Stage,Late Stage",
youngStartup Ventures,"youngStartup Ventures connects innovators, startups, and investors through exclusive Venture Summits, fostering connections for success in the entrepreneurial world.",Good,,
New York Venture Partners,"New York Venture Partners is a family office that specializes in supporting pre-seed startups through a comprehensive ecosystem that includes financing, mentorship, and strategic marketing consulting, leveraging its extensive experience from over 60 di...",Very strong,"Pre-Seed,Seed",
Wedbush Ventures,"Wedbush Ventures is an early stage venture fund based in Santa Monica, CA, backing visionary problem solvers. We invest in seed and pre-seed stage companies founded by entrepreneurs who are passionate about solving problems in unconventional ways. Comm...",Very weak,"Pre-Seed,Seed,Early Stage","AI,Blockchain,FinTech,Healthcare,Consumer,E-Commerce / Marketplaces"
Latimer,"Latimer Ventures is a Baltimore-based early-stage Venture Capital Fund that assists Fortune 1000 Companies in making diverse acquisitions. With a focus on increasing capital flow to emerging BIPOC companies, Latimer Ventures aims to eliminate racial an...",Very weak,"Pre-Seed,Seed,Early Stage",
Bliss Enterprises,Bliss Enterprises is a company that focuses on promoting positivity and well-being through its products and services. They offer a range of wellness products and services aimed at enhancing personal growth and fostering a positive environment for indiv...,Very weak,,"Healthcare,Consumer"
Evolution Private Investment Collective,"Epic Funds offers curated private credit and equity fund investments, providing clients with a seamless and confident experience in the private markets.",Weak,,
Aiden,"Aiden Ventures is a venture capital firm that invests in early-stage technology startups. They provide funding, mentorship, and strategic support to help entrepreneurs grow their businesses.",Weak,"Angel,Seed,Early Stage",
Sixty Degree Capital,"Sixty Degree Capital is an investment company specializing in venture capital and private equity. They focus on investing in biopharmaceuticals, healthcare platforms, and technology, supporting companies across different sectors and stages to drive mea...",Very weak,,"Healthcare,Biotech / Life Sciences"
Kairos Ventures,"Kairos Ventures is a pioneering investment firm that supports and commercializes the world's leading scientific discoveries from top universities and scientists. With a focus on groundbreaking startups in life sciences, physical sciences, and technolog...",Very weak,"Seed,Early Stage,Growth Stage","AI,Biotech / Life Sciences"
50 Partners,"50 Partners is a leading startup accelerator in France, founded by 50 successful entrepreneurs from companies like BlaBlaCar, Showroomprivee, Le Bon Coin, and more. They provide high-quality mentoring, financing, international connections, networking, ...",Very weak,"Angel,Pre-Seed,Seed,Series A,Series B,Early Stage","FinTech,Consumer,E-Commerce / Marketplaces"
Venture Forward,"Venture Forward is a nonprofit shaping a diverse future for venture capital, supporting investors to empower underrepresented groups in funding innovative founders.",Very weak,,
BlockTower Capital,"BlockTower Capital is an institutional investment firm focused on cryptocurrency and blockchain technology. They offer a range of investment strategies including active trading, market neutral strategies, credit investing, and venture capital. Founded ...",Weak,,"Crypto,Blockchain"
C2 Ventures,"C2 Ventures is an early stage investment platform that bridges the gap between founders and capital by providing support, connections, and experience. They partner with Pre Series A companies developing enterprise software and robotics solutions for le...",Very weak,"Angel,Pre-Seed,Series A,Early Stage","Enterprise,Robotics"
Northzone,"Northzone is a technology investment partnership with over two decades of experience. They have invested in over 120 companies, focusing on disruptive businesses tackling challenging problems. With offices in London, Stockholm, Oslo, and New York, Nort...",Very weak,"Pre-Seed,Seed,Series A,Early Stage",
Boldstart Ventures,"Boldstart Ventures is a day one partner and true believer for developer-first, crypto infra, and SaaS founders, providing early-stage funding and support to turn bold ideas into iconic companies.",Very weak,"Angel,Seed,Series A,Early Stage","Blockchain,FinTech"
Commerce Ventures,Commerce Ventures is a venture capital firm empowering technology innovators in retail and financial services to shape the future of industries through strategic investments and partnerships.,Very weak,,"FinTech,E-Commerce / Marketplaces"
a16z crypto,a16z crypto is a leading venture capital fund specializing in investments in crypto and web3 startups since 2013. They support innovative entrepreneurs shaping the future of the internet and provide valuable insights on all things crypto and web3 throu...,Very weak,"Angel,Seed,Early Stage","Web3,Crypto,Blockchain"
Eden Holdings,"ED3N Ventures is a leading web3 venture studio dedicated to building projects that enable the open metaverse. They work with founders to develop solid business and web3 strategies, provide expertise, funding, and access to a strategic network of partne...",Very weak,"Angel,Seed,Early Stage","Web3,Metaverse,E-Commerce / Marketplaces"
Dissent Capital,Crypto Venture Fund of Funds,Very weak,,
TIA Ventures,TIA Ventures is a NYC-based seed stage venture capital fund focused on scaling B2B software companies with a customer-centric approach and proven success in generating top-quartile returns.,Weak,"Pre-Seed,Seed,Early Stage","FinTech,E-Commerce / Marketplaces"
Side Door Ventures,"Side Door Ventures is a global venture capital firm that invests in audacious founders across various sectors such as software, life sciences, space, blockchain, and more. They aim to back companies that are transforming industries and improving lives ...",Very weak,,"Blockchain,Biotech / Life Sciences,Space Tech"
Fayerweather Capital Partners,Fayerweather Capital Partners is an alternative investment firm and multi-family office.,Very weak,,
General Catalyst,"General Catalyst is a venture capital firm that focuses on making early-stage and transformational investments in innovative technology companies and market-leading businesses, supporting exceptional entrepreneurs in their pursuit of powerful, positive...",Very weak,"Angel,Seed,Early Stage","Web3,AI,DeFi,Blockchain,FinTech,Healthcare,Consumer,Metaverse,Big Data,Cloud Computing,Cybersecurity,Social Media,Creator Economy,E-Commerce / Marketplaces,Climate Tech,Mobility / Transportation,Robotics,Defense Tech"
Workplace Accelerator,"Workplace Accelerator is a premier platform dedicated to accelerating HR Tech businesses across South East Asia through curated mentors, connections, and a structured 12-week program. They focus on shaping the future of work by providing expertise in W...",Very weak,"Pre-Seed,Seed,Early Stage","FinTech,Collaboration / Productivity Tools"
Champel Capital,"Champel capital focuses on investing in entrepreneurs and their visions, prioritizing the development of innovative companies that address real market needs in expansive and growing sectors, particularly those leveraging deep technology to establish si...",Very weak,"Pre-Seed,Seed,Series A,Series B,Early Stage","AI,Blockchain,FinTech,Healthcare,Big Data,Cybersecurity,Climate Tech,Mobility / Transportation,Robotics"
Lead Block Partners,"LeadBlock Partners is a European venture capital fund focusing on Blockchain & Digital Assets. They support high-quality founders in Web3 from protocol/product build to token launch and mass adoption, with a focus on corporate and institutional blockch...",Very weak,"Seed,Series A,Early Stage","Web3,Blockchain"
ADAMANT INVESTMENT PARTNERS,"AIP is an international investment and advisory firm specializing in commodities and artificial intelligence. They offer a wide range of services including principal investment, capital raising, business development, incubation, deal screening, and hum...",Very weak,,"AI,FinTech,Machine Learning"
Ocean Azul Partners,Ocean Azul Partners is an early stage venture capital firm focused on investing in founders building the future. They are passionate about supporting entrepreneurs in bringing innovative technology solutions to market and providing significant value to...,Very weak,"Pre-Seed,Seed,Series A,Early Stage","AI,Blockchain,FinTech,Healthcare,Cloud Computing,Cybersecurity"
Umami Capital,Umami Capital is a multicultural venture syndicate supporting diverse founders with investments from top funds and angels.,Weak,,
Delta Blockchain Fund,"Delta Blockchain Fund is an early stage venture capital fund founded in 2021 by World Bank, International Finance Corporation (IFC), and ConsenSys alumna Kavita Gupta. The fund supports developers and visionaries in building a decentralized world by in...",Very weak,"Pre-Seed,Seed,Series A,Early Stage","DeFi,Blockchain,FinTech"
Clout Fund,"Clout Fund is a venture capital firm that specializes in backing the future. We provide funding and support to startups in the venture capital and private equity sectors, with a focus on consumer e-commerce. Our team of principals has extensive experie...",Very weak,"Seed,Series A,Early Stage","Consumer,E-Commerce / Marketplaces"
Anthos Capital,Anthos Capital is a private investment firm supporting dynamic entrepreneurs in building disruptive companies across multiple industries.,Very weak,,
Geekcartel,"Geekcartel Ventures Incubation. BUIDL by Geeks, for Geeks. Venture Capital and Private Equity Principals",Very weak,,
1 Main Capital,"1 Main Capital is a long biased investment partnership founded by Yaron Naymark. They invest in high quality, attractively valued, growing businesses with a focus on the long term. The company is experienced, patient, flexible, disciplined, and concent...",Good,,
Goat Capital,GOAT CAPITAL founder @goat_capital @fractalwagmi @rye advising/ investing @detecttest @twitter @square @sleeperhq @tryramp @uber @xiaomi Greatest venture fund of all time. Software Development,Very weak,"Angel,Seed,Series A,Early Stage","AI,Blockchain,FinTech,Healthcare,Cloud Computing,Cybersecurity"
SignalFire,"SignalFire is a venture capital firm that leverages technology and data-driven insights to provide comprehensive support and resources for startups, from initial funding to scaling operations.",Very weak,"Seed,Series A,Series B,Early Stage,Growth Stage",
Arka,"ARKA Ventures is a venture capital firm specializing in real estate and property technology. They invest in innovative companies like Mine Furniture, Up&Up, Fantasmo, Inspectify, and Remarkably, providing solutions in furniture retail, rent-to-own plat...",Very weak,"Pre-Seed,Seed,Series A,Early Stage",
New,"Point Olema is a multi-family investments office creating institutional, endowment-style portfolios for long-term wealth sustainability.",Very weak,,
TinyTap,"Animoca Brands is a leading digital entertainment company specializing in blockchain games, traditional games, and NFT-related products. With a diverse portfolio of popular global brands like Disney, WWE, and The Walking Dead, Animoca Brands is also a ...",Very strong,"Seed,Series A,Series B,Early Stage,Growth Stage","Web3,DeFi,Blockchain,NFTs"
HYPERPYRA,HYPERPYRA is a web3 firm dedicated to researching and selecting outstanding digital assets within the emerging alternative financial landscape.,Very weak,,"Web3,Crypto"
Beresford Ventures,"Beresford Ventures, founded in 2018 by Floridian entrepreneurs, is an early-stage fund that has invested $9 million in over 140 companies across various sectors and geographies. With a unique approach of investing their own funds and being closed to ou...",Very weak,"Angel,Seed,Early Stage",
Brand Velocity Partners,"Brand Velocity Group focuses on delivering exceptional returns to its investors by identifying and supporting businesses with defensible, differentiated products or services that demonstrate consistent growth and profitability, leveraging its marketing...",Very weak,"Seed,Series A,Early Stage,Growth Stage",
Sentor Investments,"Sentor Investments is a private investment company focused on domestic and international private equity, venture capital, and listed equity investment. They target growth stage companies with proven revenue models and aim to assist portfolio companies ...",Very weak,Growth Stage,
Blockwall Capital,,Very weak,,
